,0,1,2,3,4,5,6,7,8,9,10
"Apr 3, 2021",Biden Wants to Spend $2 Trillion on Infrastructure. These Stocks Stand to Gain the Most.,,,,,,,,,,
"Apr 2, 2021",Tesla’s First-Quarter Deliveries Beat Estimates. How to Play the News.,Tesla Deliveries Smashed Expectations. The Stock Should Rise Monday.,All of Tesla's Short Sellers Have Vanished,The Jobs Report Was Way Better Than Expected. Investors Shouldn’t Overreact.,,,,,,,
"Apr 1, 2021","Momentum Makes BMW ‘Too Intriguing to Ignore,’ Says Deutsche Bank",Taiwan Semi Is Throwing Billions at the Chip Shortage,It’s a Great Time to Own Financial Stocks. Here’s Why.,,,,,,,,
"Mar 31, 2021",Lucid Motors Offers a Look Inside Its Plant. The View Is Impressive.,Goldman Sachs Is the Latest to Join the Bitcoin Stampede,The Biden Infrastructure Plan Benefits EVs. It's Even Better for Tesla Stock.,Tesla Could Be One of the Big Winners in Biden’s $2 Trillion Infrastructure Plan,Forget Voltswagen. Volkswagen Isn't Changing Its Name.,Tesla's Delivery Numbers Are Always a Big Deal. The Stakes Are Higher Now.,,,,,
"Mar 30, 2021","Voltswagen Was a Joke? Either Way, the Message Is Clear.","PayPal Users Will Be Able to Use Bitcoin, Other Cryptocurrencies for Purchases",Cathie Wood's ARK Is Launching Its Space ETF Today. What to Know About ARKX.,Self-Driving EVs Are Coming to More Markets. Here's Where They Are Headed Next.,Volkswagen Gives Investors a Pleasant Jolt. Its New U.S. Name: Voltswagen.,,,,,,
"Mar 29, 2021",EV Start-Up Canoo Reported Its Numbers. Capital Spending Is the Key.,The Value Stock Rotation Isn’t Over—Not by a Long Shot,ARK Innovation Fund Has Reshuffled Its Holdings. What That Means for Investors.,,,,,,,,
"Mar 27, 2021",Elon Musk Boasts Tesla Will Be the Biggest Company in the World. Or Maybe Not.,,,,,,,,,,
"Mar 26, 2021",Higher Taxes? Deficit Spending? Why the Stock Market Isn’t Worried.,Tech Stocks Are Back Near Dot-Com Bubble Heights—at Least by One Measure,EV Stocks Tanked This Week. The Reason Why Is Complicated.,QuantumScape Just Might EV Bull Market,Tesla Deliveries Are Coming. They Matter More Than Ever. Here's What to Expect.,,,,,,
"Mar 24, 2021",Why Did the Stock Market Go Down Today? Blame the Tech Selloff.,"How Is Tesla Stock Price Worth $3,000? By Becoming Bigger Than Apple.","Tesla Stock Could Hit $3,000, Cathie Wood Says. How the Street Compares.",Elon Musk Says You Can Buy a Tesla With Bitcoin Now. What That Means for Investors.,Bitcoin Needs Tesla More Than Tesla Needs Bitcoin,EVs Are Changing the Car Business in More Ways Than You Think,,,,,
"Mar 23, 2021",The Moonshot ETF Is Beating ARK Innovation for Now. Beware the Risks Involved.,,,,,,,,,,
"Mar 22, 2021","U.S. Stocks Close Higher, Led by Tech","Volkswagen Could Have the EV Edge Over Tesla in a Year, Says Deutsche Bank",Chinese Business Forum Leaders’ Message: Strengthen U.S. and China Ties,Cathie Wood's New Tesla Price Target Is Out,"Snap Stock Sinks, Pepsi Gains as Tech Stocks Stage a Comeback",Bond Vigilantes Unlikely to Trigger a New Black Monday for Stocks,How to Play the New Space Race,,,,
"Mar 20, 2021",Elon Musk Tells China That Tesla Won't Share Data,Baillie Gifford Partner James Anderson Will Retire in 2022,,,,,,,,,
"Mar 19, 2021",The Market Isn’t Fighting the Fed. What That Means for Stocks.,The Dow Fell 234 Points Because Overextended Value Stocks Tripped,Watch These Stocks as Zero-Emissions Vehicles Bring Disruption to the Trucking Market,Executives of AmTrust Financial Launch a SPAC,Tesla Stock Is Falling Again. There's Too Much Going On.,"Sun Is Shining on Convertible Bonds, Built for Good or Bad Weather",,,,,
"Mar 18, 2021",Tesla Is Down. GM and Ford Are Up. How Rates Play With Stocks.,The Dow Fell 153 Points Because Stock Investors Are Wary of the Fed,This 'EV' Stock Has Gained 70% in a Month. It's Not Tesla.,The Stock Market Today: Why Tech Is Getting Crushed Again,,,,,,,
"Mar 17, 2021",Dow Jones Industrial Average Rose as the Fed Soothed Investors,BMW’s EV Plans and Outlook Charge Shares. Why You Should Keep Watch.,It’s Fed Day—and Tech Stocks Are Terrified,The Space Race Has Long Led to Business Opportunities,,,,,,,
"Mar 16, 2021",Volkswagen Stock Is Soaring Because It’s an EV Company Now,XPeng Gets Cash From a Chinese Government Fund,Volkswagen Is Coming After Tesla. What It Means for Both Stocks.,"Tesla, Nikola, and the Weirdness in EV Stocks",,,,,,,
"Mar 15, 2021",The Dow Rose 175 Points to a Record After Shaking Off Losses,Volkswagen Targets Battery Costs and Plans Gigafactories in First Annual ‘Power Day’,Elon Musk Is Now the 'Technoking' of Tesla. What's Behind the Name.,"As the Covid-19 Pandemic Fades, the U.S. Economy Could Soar",Higher Rates Won’t Kill the Stock Market,How to Play the Valuation Gap Between Growth and Value Stocks,"America’s Top 1,200 Financial Advisors: Our Annual State-by-State Listing",,,,
"Mar 13, 2021","Bitcoin Hits $60,000, Meaning Tesla Has Made a Lot of Money","One Bank Made Big Bets on Apple, Tesla, Nio, and Other EV Stocks",,,,,,,,,
"Mar 12, 2021","Dow, S&P 500 End the Week at New Highs as Tech Stocks Tumble",Short Seller Takes Aim at Another EV Maker. Its Stock Is Tumbling.,Tesla Stock Is Down. You Could Blame Joe Biden.,,,,,,,,
"Mar 11, 2021",Tesla Stock Has Gotten Crushed. Wall Street Is Getting More Optimistic.,,,,,,,,,,
"Mar 10, 2021",Taiwan Drought Threatens to Hurt Production of Chips,"Tesla, EV Stocks Are Ripping Again. Here's Why.","Tesla, Other EV Stocks Are Rebounding. That Doesn't Mean the Bubble Won't Pop.",,,,,,,,
"Mar 9, 2021",Dow Jones Industrial Average Rose as Tesla and Amazon Stock Roared Back,Tech Stocks Rebound as Bond Yields Decline,XPeng Shares Have Fallen Far Enough for One Analyst,Tesla Stock Is Rising Today. Here Are 3 Reasons.,"Tesla Stock Jumps, Stitch Fix Slumps as Tech Stocks Lead Market Higher",Tech Stocks Are Snapping Back. It Doesn’t Mean the Pain Is Over.,,,,,
"Mar 8, 2021",Workhorse Is Soaring While Other EV Stocks Slump. Congress Is the Key.,"Dow Rises, Nasdaq Falls on Bond Yields and Stimulus","Microsoft Stock Slips, GE Jumps as Stimulus Fails to Lift S&P 500",ARK’s Cathie Wood Disrupted Investment Management. She’s Not Done Yet,,,,,,,
"Mar 7, 2021",The Reflation Trade Is Stirring Growing Pains in Growth Stocks. Here’s Why.,Two Companies for Investors to Watch as They Reinvent Themselves,Cathie Wood Has a New Tesla Target Price Soon. Here's Where It Might Be.,,,,,,,,
"Mar 6, 2021","Taiwan, Korea Hold Keys to U.S. Tech Supply Security",,,,,,,,,,
"Mar 5, 2021",Tesla and Other Hypergrowth Stocks Could Tear Down What They Built Up,The SPAC Market Is Red Hot. Why That Could Spell Trouble.,EV Stocks Have Lost a Ton of Value. Here's Just How Much.,Tesla Stock is Cratering. This Is How Much Interest Rates Hurt.,The Next Frontier for Space and Tesla,Nikola Stock Falls. Its Founder Sold Shares and an Analyst Is Less Bullish.,,,,,
"Mar 4, 2021",EV Stocks NIO and Tesla Are Falling Again. Here's Why.,Bitcoin Is Hitting the Mainstream Even as Its Environmental Toll Mounts,,,,,,,,,
"Mar 3, 2021",ARK's Red-Hot ETF Fell 20% in 12 Days. The Pain for Tech Stocks Isn't Over.,The Dow Fell 121 Points Because Higher Rates Wrecked Growth Stocks,How Much Is Tesla Software Worth? A Lot.,EV Stock Fisker Is Slipping Despite an Upgrade. The Narrative Has Changed.,,,,,,,
"Mar 2, 2021",NIO Stock Is Falling. Here's What Analysts Are Saying.,,,,,,,,,,
"Mar 1, 2021",Plug Power Stock Is Surging. J.P. Morgan Is Upbeat on the Shares.,"ARK ETFs Were Hot, And Competitors Emerged. Now They’re All Falling.",Why the Stock Market Is Bouncing Back After a Brutal Week,It's Been an Epic Week for Fisker. Here's What Wall Street Is Saying.,What to Buy When Good News Means Bad News for the Stock Market,Tesla Could Save the Auto Business by Disrupting It. Here's How.,,,,,
"Feb 28, 2021","A Giant Pension Bought Up PG&E, Zoom, and a Stock Elon Musk Loves",,,,,,,,,,
"Feb 27, 2021",The Best Online Brokers for 2021: The Rise of the Individual Investor and Fintech Apps,,,,,,,,,,
"Feb 26, 2021","Scorched Stock Investors Learn That Bonds Aren’t So Boring, After All",A SPAC Fuels the Takeoff of Electric Air Taxis,GameStop Stock Volatility Could Get Even Worse. Here's Why.,Strange 12 Months Offers Investors Scant Guidance for the Rest of 2021,Bitcoin Has Tumbled More Than 20%. What to Make of Its Bear Market.,"Flying Cars, of a Sort, Are Coming. There Are Two Stocks for That.",,,,,
"Feb 25, 2021",Coinbase Could Go Public as Soon as March,Bitcoin May Be Weighing on Tech Stocks Again. Investors Should Be Wary.,Tesla's Model 3 Line Is Shut. Here's What That Means.,The GameStop Music Is Playing Again. Don’t Be Left Standing When It Stops.,,,,,,,
"Feb 24, 2021","Lucid Falls, Fisker Soars. The Valuation Gap Closes a Little.",Wall Street Is Obsessed With an Apple Car. Tech Analysts Might Be Too Excited.,Chinese EV Maker Li Auto Reports Earnings Thursday. It Will Be Big.,Structured Notes Are Hot. But Investors Should Mind the Fine Print.,An Alternative-Energy Fund Favors Yield Companies and Avoids Tesla Stock,,,,,,
"Feb 23, 2021",Dow Jones Industrial Average Rose as Value Stocks Are Riding Rates Higher,U.S. Stocks Pare Earlier Losses,Tech Stocks Outside U.S. Also Hammered as Interest Rates Rise,Value Stocks Help Push Mutual Funds to a Strong Start,The Bitcoin Bubble Could Be Popping. It's a Headwind for Some Highflying Stocks.,"ARK Innovation ETF Plunges on Tesla, Roku Pullback","Tesla Stock Selloff Continues, and EV Values Are Making No Sense",Ex-GE CEO Jeff Immelt Has a Lot to Say. Investors Should Listen.,XPeng Shareholder Is Selling Stock. It Doesn't Raise Money for the EV Company.,Tech Stocks Are Getting Crushed Again. What’s Behind the Selloff.,Lucid Motors Is Going Public. The Merger Partner Stock is Crashing.
"Feb 22, 2021",Tesla Stock Is in a Bear Market. It's Taking Other EV Stocks With It.,,,,,,,,,,
"Feb 21, 2021",Tesla Is Up $1 Billion on Bitcoin Investment,"A Giant Fund Bought EV Stocks NIO and Tesla, and Intel. Here’s What It Sold.",,,,,,,,,
"Feb 19, 2021",A Message From the Mars Rover: It's Time to Invest in Space,Bitcoin Market Value Rises Past $1 Trillion. What It Means for Cryptocurrencies.,Barron’s Best Fund Families of 2020,NIO Stock Is Slumping. There's Probably Nothing Wrong.,,,,,,,
"Feb 18, 2021",Dow Jones Industrial Average Fell as High Rates and Jobs Data Were a 1-2 Punch,Tesla Cuts Model 3 Prices in Japan. Here Are Other Price Cuts It Has Made.,"Walmart Drops, Tilray Pops, and Tech Is Leading the Market Lower Again",,,,,,,,
"Feb 17, 2021","Bitcoin Punches Above $51,700. Is This Rally Different?",Tesla Electric-Truck Rival Volta Announces Good News for Battery Suppliers,,,,,,,,,
"Feb 16, 2021",This EV-Related Company Has Big Plans to Recycle Batteries,Bitcoin Briefly Crossed $50K. Regulators Are Circling.,Apple iCar Speculation Continues. How Tech and Auto Analysts See the Car.,"Convertible Market Remains Attractive, Says Tracy Maitland of Advent Capital Management",Tesla May Be Going to India. It's a Step Toward Lower-Cost EVs.,"Virgin Galactic Stock Is Going Crazy, Within a Trading Range",,,,,
"Feb 15, 2021",What Is Berkshire Hathaway’s Mystery Stock? Big Investment by Warren Buffett Could Be Disclosed Today.,This Is Where the Real Stock Market Bubble Is,,,,,,,,,
"Feb 14, 2021",The Shelton Green Alpha Fund Soared 114% in 2020. Its Manager Talks Strategy.,,,,,,,,,,
"Feb 13, 2021",Hyliion Doesn't Fear Disruption. It Has Plans of Its Own.,"Today’s Stock Mania Differs From 1999’s, but That Might Not Matter",,,,,,,,,
"Feb 12, 2021",Bitcoin Soars to New Highs as More Businesses Warm to Cryptocurrencies,The SEC Finally Says Enough to One Social Media-Fueled Trade,More Questions Surface Over Tesla's EV Ranges,,,,,,,,
"Feb 11, 2021",This Investment House Says ‘Value’ Stocks Don’t Exist. Why It Matters.,"Kimbal Musk, Elon's Brother, Sells Some Tesla Stock",Why Companies Like Peloton Are Issuing Convertible Debt on Attractive Terms,Barron’s Centennial: Electric Vehicles Were a Nonstarter—Until Tesla Came Along,,,,,,,
"Feb 10, 2021","Tesla's EV Range Isn't All It's Cracked Up to Be, Edmunds Says",How Volta's EV Strategy Differs From Beam or Blink,,,,,,,,,
"Feb 9, 2021",Nasdaq Hits Yet Another High,"China Lunar New Year Spending Will Be Better, But Not Great This Year",How Bitcoin Explains Everything,,,,,,,,
"Feb 8, 2021",,Tesla Drops a Bitcoin Bombshell With $1.5 Billion Purchase,"The Investor Who Called Tesla Stock at $1,000 Has Sold His Shares","Hot EV Stock Volta Isn’t Public Yet, but It Is Lighting Up the Market",Elon Musk Gives $100 Million in Prizes for C02 Removal,,,,,,
"Feb 7, 2021",GM’s Super Bowl Ad Featuring Will Ferrell Will Focus on its Electric Vehicles,Many Funds Doubled Their Returns Last Year. That’s Not Necessarily Good News.,,,,,,,,,
"Feb 5, 2021",Ford Enters the EV Arms Race. Here’s What Wall Street Thinks.,,,,,,,,,,
"Feb 4, 2021",These 4 Small-Cap EV Stocks Are Soaring. Why Now?,Tesla’s Elon Musk Is Back—and So Is Dogecoin,General Motors and Other Car Makers Have Big EV Goals. Why the Numbers Make No Sense.,,,,,,,,
"Feb 3, 2021","Sell Hyliion Stock, Analyst Says. Its Disruptive Tech Might Get Disrupted.",Apple Car Rumors Won’t Stop. Kia Stock Is Rising.,Amazon CEO Jeff Bezos Is Stepping Down. Here’s How He Did.,SPACs Are Giving Investors More EV Stocks. But Not Every One Can Be Tesla.,,,,,,,
"Feb 2, 2021",DraftKings Jumps as ARK ETF Adds Shares,,,,,,,,,,
