Date,Label,Top1,Top2,Top3,Top4,Top5,Top6,Top7,Top8,Top9,Top10,Top11,Top12,Top13,Top14,Top15,Top16,Top17,Top18,Top19,Top20,Top21,Top22,Top23,Top24,Top25
2008-08-08,0,georgia down two russian warplane country move brink war,break musharraf impeach,russia today column troop roll south ossetia footage fighting youtube,russian tank move towards capital south ossetia reportedly completely destroy georgian artillery fire,afghan child rape impunity u n official say sick three year old rape nothing,150 russian tank enter south ossetia whilst georgia shoot two russian jet,break georgia invade south ossetia russia warn would intervene side,enemy combatent trial nothing sham salim haman sentence 5 1 2 year keep long anyway feel like,georgian troop retreat osettain capital presumably leave several hundred people kill video,u prep georgia war russia,rice give green light israel attack iran say u veto israeli military op,announce class action lawsuit behalf american public fbi,russia georgia war nyt top story opening ceremony olympic fucking disgrace yet proof decline journalism,china tell bush stay country affair,world war iii start today,georgia invade south ossetia russia get involve nato absorb georgia unleash full scale war,al qaeda face islamist backlash,condoleezza rice us would act prevent israeli strike iran israeli defense minister ehud barak israel prepare uncompromising victory case military hostility,busy day european union approve new sanction iran protest nuclear programme,georgia withdraw 1 000 soldier iraq help fight russian force georgia breakaway region south ossetia,pentagon think attack iran bad idea us news amp world report,caucasus crisis georgia invade south ossetia,indian shoe manufactory series like work,visitor suffer mental illness ban olympic,help mexico kidnapping surge
2008-08-11,1,will not america nato help us will not help us help iraq,bush put foot georgian conflict,jewish georgian minister thank israeli training fend russia,georgian army flee disarray russians advance gori abandon russia without shot fire,olympic open ceremony firework fake,mossad fraudulent new zealand passport iraq,russia anger israeli military sale georgia,american citizen live ossetia blame u georgian leader genocide innocent people,welcome world war iv high definition,georgia move mistake monumental proportion,russia press deep georgia u say regime change goal,abhinav bindra win first ever individual olympic gold medal india,u ship head arctic define territory,drivers jerusalem taxi station threaten quit rather work new boss arab,french team stun phelps 4x100 m relay team,israel us behind georgian aggression,believe tv neither russian georgian much victim,riot still go montreal canada police murder boy saturday,china overtake us large manufacturer,war south ossetia pic,israeli physicians group condemns state torture,russia beaten united states head peak oil,perhaps question georgia russia conflict,russia much well war,come trade sex food
2008-08-12,0,remember adorable 9 year old sing open ceremony fake,russia end georgia operation,sexual harassment would child,al qa eda lose support iraq brutal crackdown activity regard un islamic include woman buy cucumber,ceasefire georgia putin outmaneuvers west,microsoft intel try kill xo 100 laptop,stratfor russo georgian war balance power,try get sense whole georgia russia war vote think georgia start think russia,us military surprise timing swiftness russian military move south ossetia still try sort happen us defense official say monday,u beats war drum iran dump dollar,gorbachev georgian military attack south ossetian capital tskhinvali multiple rocket launcher design devastate large area,cnn use footage tskhinvali ruin cover georgian report video,begin war olympics opening violate ancient tradition truce conflict game ioc could respond take 2014 game away russia,55 pyramid large luxor stack mega city pyramid tokyo bay,11 top party city world,u troop still georgia know georgia first place,russias response georgia right,gorbachev accuse u make serious blunder pursue interest caucasus region,russia georgia nato cold war two,remember adorable 62 year old lead country war base evidence fake,war georgia israeli connection,sign point us encourage georgia invade south ossetia goddamnit bush,christopher king argue us nato behind georgian invasion south ossetia misjudge russian resolve,america new mexico,bbc news asia pacific extinction man climate
2008-08-13,0,u refuse israel weapon attack iran report,president order attack tskhinvali capital south ossetia know doom come realize,israel clear troop kill reuters cameraman,britain policy tough drug pointless say former civil servant run cabinet anti drug unit,body 14 year old find trunk late ransom pay kidnapping victim mexico head cop quit prez dissolves suspect elite task force,china move 10 million quake survivor prefab home,bush announce operation get russia grill yeah end well,russian force sink georgian ship,commander navy air reconnaissance squadron provide president defense secretary airborne ability command nation nuclear weapon relieve duty,92 cnn reader russia action georgia justify,usa send fleet black sea help georgia send troop humanitarian aid exercise,us warn israeli plan strike iran nuclear facility,intriguing cyberalliance two estonian computer expert head georgia keep country network run amid intense military confrontation russia,cnn effect georgia schools russia information warfare,russias response georgia right,elephant extinct 2020,us humanitarian mission soon georgia russia hit us wwiii,georgia ddos come us source,russian convoy head georgia violate truce,israeli defence minister us strike iran,gorbachev choice,witness russian force head towards tbilisi breach ceasefire agreement,quarter russians blame u conflict poll,georgian president say us military take control seaport airport pentagon deny,2006 nobel laureate aleksander solzhenitsyn accuse u nato encircling russia
2008-08-14,1,expert admit legalise drug,war south osetia 89 picture make russian soldier,swedish wrestler ara abrahamian throw away medal olympic hissy fit,russia exaggerate death toll south ossetia 44 originally kill compare 2 000,missile kill 9 inside pakistan may launch cia,rushdie condemns random house refusal publish novel fear muslim retaliation,poland us agree missle defense deal interesting timing,russians conquer tblisi bet seriously bet,russia exaggerate south ossetian death toll say human right group,musharraf expect resign rather face impeachment,moscow make plan month ago invade georgia,russias response georgia right,nigeria hand potentially oil rich bakassi peninsula cameroon,us poland agree preliminary deal plan controversial us defence shield,russia apparently sabotage infrastructure cripple already batter georgian military,bank analyst forecast georgian crisis 2 day early,georgia confict could set back russia us relation year world news guardian co uk,war caucasus much product american imperial drive local conflict,non media photo south ossetia georgia conflict,georgian tv reporter shoot russian sniper live broadcast video,saudi arabia mother moves block child marriage,taliban wages war humanitarian aid worker,russia world forget georgia territorial integrity,darfur rebel accuse sudan mount major attack,philippines peace advocate say muslims need assurance christians convert
2008-08-15,1,mom miss gay man bad 21 year old cheerleader still look,russia u poland missile deal go unpunished,government accuse create law chill effect freedom expression uk critical report un committee human right,italian government lash influential catholic magazine suggest fascism may resurface within government,gorbachev georgia start conflict ossetia,china fake girlfriend ethnic minority child olympic ceremony fake,un criticism freedom expression uk valid,russian general threatens nuclear strike poland bush demand moscow withdraws georgia,russia inspect polish missile defence site,russia georgia conflict fuel rush control caspian energy resource,business week victory georgia give russia edge struggle access caspian 35 billion barrel oil trillion cubic foot gas,soviet rule believe word propaganda learnt west propaganda powerful people believe,minister accuse build national dna database stealth retain profile nearly 40 000 child never convict crime,russia georgia forget regaining province,russians seize us weapon depot georgia,redditor generally supportive russia invasion georgia critical americas iraq,johann hari need stop coward islam,us official say military presence georgia become permanent,israel clear troop kill reuters cameraman,unenforceable law encourage cop escalate tactic tragedy occur,chinese pollution really look like,hacker kidnaps torture informant post picture warn other,bush tell putin aggression stand,georgia oil pipeline,rival say plan remove georgian president
2008-08-18,0,afghan prison majority female prisoner serve 20 year sentence victim rape,little girl ugly,pakistan musharraf resign leave country,tornado throws bus poland capture one passenger,britain terror law leave family shatter,iran fire satellite space,right non muslims restrict new maldive constitution,tour tskhinvali undercuts russian version fighting,great resource war already underway mainly middle east also small skirmish scatter area around world disguise many global war terror,190 000 us contractor work iraq,russia move ss 21 missile georgia us defense official,president say resign avoid impeachment battle would harm nation interest,democratic georgia shuts opposition tv channel own russians,new cold war option russian parliamentarian,georgian situation continue quest prize oil money power,mi5 seek gay spy,new porn channel let canadians strut stuff,dangerous neighbor vladimir putin take powerless west,israel opinion page russians saner,nato hour,georgian president saakashvili eat tie live tv,chicken leave behind animal rfid surveillance arrive force,putin give us order everyone must leave shoot,national dna database grow gene innocent,mayor ask ugly woman visit town
2008-08-19,0,man arrest lock five hour take photo police van ignore entry sign,us missile defence system magic pudding never run,schrder lambaste blame russian conflict georgia,official 10 french soldier kill near kabul,ten law make china totalitarian wasteland,russia seize us vehicle,muslims 4 denmark 5 4 million people make majority country convict rapist practically female victim non muslim,taliban force kill 10 french soldier raid u base,assaults kidnappings killings humanitarian aid worker double past five year,south ossetia kosovo,finally olympic image take mind michael phelps pic,new york laser graffiti artist detain indefinitely beijing tibet protest art,us leave isolated nato plan maintain relation russia,drive shai agassi audacious plan put electric car road,nato freeze russian tie georgia,brazil play military war game defend recently discover offshore oil,16 000 fine british woman catch share game online,102 year old grandma old person facebook,today 5 year ago august 19th 2003 bombing un headquarters iraq,us national ken haywood whose computer find send threat email serial bomb blast india flee country,taliban kill 10 french troop near afghan capital,everybody love offshore wind power spain,taliban force kill 10 french soldier raid u base,pakistan democratic america,blaze engulfs egyptian parliament
2008-08-20,1,two elderly chinese woman sentence year education labor seek permit demonstrate official olympic protest area,power islam human rights council united nations ban criticism regard sharia law human rights islamic world,55 time military soldier first gulf war contractors current iraq war ratio 1 1,live less dollar month obama brother kenya shanty town,russia send aircraft carrier syria,american people eternally grateful old europe spike bush mccain plan bring georgia nato,abkhazia officially appeal russia independence,russia warn response beyond diplomacy us missile shield,india set aside 40 regional wasteland jatropha biodiesel production,elderly chinese woman sentence labor education apply permission protest olympic,plane skid runway madrid,taliban mount ferocious assault ally target,150 fear dead spanair plane crash madrid,western intelligence involve terrorist attack india westerners computer internet connection use send terror e mail minute ahmedabad blast,spanish freedom speech die ignoble death spanish parasite offend,grote markt pic,russia inform norway plan cut military tie nato,aim war french opposition demand rethink afghanistan mission,bush cover musharraf ties al qaeda,mikhail gorbachev russia never want war,germans urge tough law new privacy scandal,time wimps dialogue russia choice,1998 missile strike bin laden may backfire,moment let forget everything else pay homage unsung hero,first solar radio station argentina
2008-08-21,1,british resident hold guantanamo bay win legal battle force foreign office reveal torture evidence,chinese may kill 140 tibetans week dalai lama,u navy ship head georgia,hacker uncovers chinese olympic fraud,ever wonder kim jong il like grade school go yes quite ronery also order former teacher whole family kill,russia nuclear threat word,czech president must protest aloud incorrect interpretation situation caucasus,50 food produce waste get use,china sentence alive baghdad blogger grl james powderly amp 4 citizen journalist 10 day jail cover tibet protests olympics,go ahead let georgia declare war nato russia half wit small country leader get audition role archduke ferdinand,cafferty georgia start war russia vid,kazakhstan consider divert oil export away btc pipeline run georgia use russia instead reason,russia threaten sale offensive weapon israel enemy,belfast police confiscate boardgame terrorist crackdown,world oldest man die age 138,russia condemn us missile deal,natos decision freeze relations moscow washingtons inept handle pakistan strategic foreign policy mistake,sweet sixteen fraudulent fourteen hacker unearth underage gymnast allegation,russias feel churlish pretty much bring grind halt kind coercive action,chinese gymnast 14 official document show,suicide attack kill least 50 pakistan arm factory,abkhazian parliament approve official appeal russia recognise independence,georgia bulgaria second balkan war afoe fistful euros european opinion,terrorist reveal pak sinister design india,international olympic committee launches probe kexin age
